{
  "$schema": "../interfaces.web/web-provider.schema.json",
  "webProvider": 1,
  "name": "base-controls",
  "implements": [
    {
      "interface": "../interfaces.web/ui-controls.interface.json",
      "version": "1.0.0"
    }
  ],
  "bindings": {
    "@web/ui-controls/": "./"
  },
  "features": {
    "theme": "base",
    "behavior": "dom-events"
  },
  "exports": {
    "define": "./define.js",
    "theme": "./theme.css"
  }
}

